<?xml version="1.0" ?>
	<!DOCTYPE email SYSTEM "q-7.dtd">
	<email>
		<from></from>
		<to></to>
		<content>
			<person></person>
			<exercises>
				<exercise>
					<topic></topic>
					<description></description>
				</exercise>
			</exercises>
		</content>
		<course>
			iMscIT
		</course>
	</email>